{
	"schema_version": 1,
	"created_at": "2026-03-08T09:00:00Z",
	"day_start_offset_hours": 4,
	"projects": [
		{
			"id": "Ab12Cd34",
			"name": "Client Work",
			"color": "light_cyan",
			"archived": false
		},
		{
			"id": "Ef56Gh78",
			"name": "Personal",
			"color": "light_green",
			"archived": false
		}
	],
	"tasks": [
		{
			"id": "Tsk12345",
			"project_id": "Ab12Cd34",
			"category_id": null,
			"description": "Ship the shared ledger contract",
			"archived": false
		},
		{
			"id": "Run67890",
			"project_id": "Ef56Gh78",
			"category_id": "Cat12345",
			"description": "Morning run",
			"archived": false
		}
	],
	"categories": [
		{
			"id": "Cat12345",
			"name": "Health",
			"description": "Personal wellness tasks",
			"archived": false
		}
	]
}
